제목,가사,가수,발매일,좋아요수,장르
버스야 돌고 돌아 다시 내게 오라,"보세 옷 코디를 갖춰
향수를 뿌리고 나서
멍하니 거울을 봤어
뭔가 어색해 보였거든
친구를 잃은 기분만큼의
발걸음은 가벼워서
너 카드를 두고 나온 것도
깜빡한 거니
목적지에는 차피 나 밖에
없는데 정신은 깜빡깜빡
혼자서 지구를 한 바퀴 돌아도
신호는 더럽게도 안 바뀌어
줄이 길게 늘어선 신논현역 앞에
표정들의 무게를 가늠하니 답답해
안내방송에 안주하면서 자다 깨다를
반복하다 보니 어느새 다 왔네
난 이번에 내려야 되는데
급하게 탄 여성분 너를 닮았네
혹시나 해서 고개를 떨군 채로
눈을 굴리며 불편하게 앉았네
모자를 푹 눌러 쓰고
이어폰 볼륨을 올려
네 향수 냄새가 기억 안 나지만
심박수를 올렸네
내 옆이 네가 아닌 걸 알아
But 대역 죄인 잡고 싶은 손가락
의자의 표면에서 내가 멀어지고
아무런 파동이 없는 공간이 곧
펼쳐지면 느껴 둘만의 숨을
피어싱 끼는 그녀의 살결이 스쳐
내 변태 같은 생각에 불만 있어도
피곤에 찌들어 외로운 뇌를
꺼줄 수는 없잖아
목적지에는 다 와가는데
어느새 그녀는 꿈뻑꿈뻑
혼자서 망상을 한 다음에
신호는 노란색으로 바뀌어
줄이 길게 늘어선 가로등을 지나
츄리닝을 보이며 어깨에 곤히 잠든
그녀는 내 목에 숨을 불었지만
내 숨은 멈춘 게 분명한 시간
나 이번에 내려야 되는데
급하게 탄 여성분 먼저 깨웠네
혹시나 해서 고개를 든 채로
눈을 굴리며 서로 빤히 쳐다봤네
모자를 푹 눌러 쓴 그녀
살짝 보인 미소 아름다워
그 향수 냄새를 기억할 때쯤에
번호 묻기엔 너무 늦었네",래원 (Layone),2021.02.25,"7,183",랩/힙합
사랑이니까,"내가 널 놓쳐도
네가 날 잡아줘
그게 사랑이니까
내가 술에 취해도
귀를 기울여줘
전부 널 위한 거니까
let me let me
let me die in your arms
in your arms
우리 좋았던 때로 back in time
마치 오늘 처음 만난 사이같이
그럼 난 또 뻔하게 다시
make you mine
의심하지 마 어차피 난
너를 사랑하는데
여전히 난 시간 지나도
너의 곁에 남아있을 텐데
맞춰가는 게 참아주는 게
지금 많이 힘이 들어도
너도 잘 알겠지만 나도 여태
그랬으니 조금만 더 믿어줘
난 너 아닌 모든 것들과 싸워야만 해
널 포함한 내 전부를 지켜내야 해
네가 떠나면 난 뭘 위해 살아가야 해
잠시 뒤를 돌아봐도 좋으니
부를 때면 다시 날 돌아봐줄래
너의 탓이 아냐 우린 최선 다했었는데
싸우지 않아도 돼 누구의 탓도 아닌데
시간 돌려봐도 결과는 같을 텐데
우리가 왜 이런 일로
시간 낭비를 해야 해
내가 떠나면 너 먼저 후회할 거잖아
난 그걸 알아서 여태 받아줬잖아
여태까지 우리 잘 노력해 왔잖아
지금 포기하면 그 모든 게 의미 없잖아
내가 널 놓쳐도
네가 날 잡아줘
그게 사랑이니까
내가 술에 취해도
귀를 기울여줘
전부 널 위한 거니까
let me let me
let me die in your arms
in your arms
우리 좋았던 때로 back in time
마치 오늘 처음 만난 사이같이
그럼 난 또 뻔하게 다시
make you mine",이한울,2022.11.24,666,"랩/힙합, 인디음악"
나비효과 (Feat. SG워너비),"꽃 향기따라 행복을 찾고픈 나비
저 별빛과 닮은 넌
내게 사랑을 속삭여줘
날 우주라 믿어줘
너란 별을 안을 수 있게
함께 있어 고마워
넌 내게 영원한 작은 별
난 나비 그대는 꽃 향기
너의 눈 웃음에 천국을 걸어
지금 심정 거짓말
조금 보태서 말하자면
내 목숨도 걸어
주위에선 내 얼굴이 환해졌대
예전과는 사뭇 다른 여유랄까
뭔가 다른 나의 미소랄까
아무튼 너무 많이 달라졌대
난 너에게 딱 달라 붙은 스티커
내 입은 운명을 부르는 스피커
날 봐 밤이건 낮이건
넌 나를 뛰게 하는 아킬레스건
고단한 삶의 인생을 바꿔놓은
butterfly effect
그대가 바로 나의 나비효과
그대 사랑이 나의 나비효과
꽃 향기 따라 행복을 찾고픈 나비
저 별빛과 닮은 넌
내게 사랑을 속삭여줘
날 우주라 믿어줘
너란 별을 안을 수 있게
함께 있어 고마워
넌 내게 영원한 작은 별
다들 사랑에 굶주린 듯해
외로움에 치를 떠는 듯해
급하게 허겁지겁 밥을 먹듯
다들 체할 것 처럼
그렇게 사랑을 해
가끔은 시기와 질투에 넘어져
처음 사랑의 감정을 잃어버려
강렬한 사랑은 추억이 더해져
본래의 가치를 훨씬 뛰어넘어
butterfly effect
그걸 믿어 나의 선택
그대의 날갯짓 그 하나 하나가
살며시 내 운명의 목표를 바꿔놔
고단한 삶의 인생을 바꿔놓은
butterfly effect
그대가 바로 나의 나비효과
그대 사랑이 나의 나비효과
저 별을 따라 난 꿈꾸고
잠에서 깨어나 널 안을게
내 사랑이 크다면
평생 나만 믿어주겠니
함께 있어 고마워
난 너를 영원히 사랑해
꽃 향기 따라 행복을 찾고픈 나비
저 별빛과 닮은 넌
내게 사랑을 속삭여줘
날 우주라 믿어줘
너란 별을 안을 수 있게
함께 있어 고마워
넌 내게 영원한 작은 별
눈부신 빛의 속도로 타임머신 타고
그대와 나 붉은 빛 무지개를 걷고
눈부신 빛의 속도로
타임머신 타고
저 하늘의 몸을 실어
큰 구름을 걷고
눈부신 빛의 속도로 타임머신 타고
그대와 나 붉은 빛 무지개를 걷고
눈부신 빛의 속도로
타임머신 타고
저 하늘의 몸을 실어
큰 구름을 걷고",MC몽,2009.07.23,"2,703",랩/힙합
LAND (Feat. nafla),"기분이 이상해
잠을 자지도 못했는데
지금 우리 이 텐션에 건배
아니 뭐 이거 뭐야
Fuck them hoes I got you by my side
서로가 서로를 원하잖아
빠져나와 가상현실 인스타
오늘 밤부터 우리 모두 인싸
One million is what you want
팔로워 or 지갑의 돈
내가 원하는 거는 just fun
둘 다 나쁘다는 건 아냐 물론
형님 너무 serious 마 이게 힙합
행복하자 show me some love love
huh huh ooh ooh
huh huh ooh ooh
huh huh ooh ooh
huh huh ooh ooh
huh huh ooh ooh
huh huh ooh ooh
huh huh ooh ooh
힙합하러 집을 떠났지
통기타를 치곤 하던 아이가 나
요새는 공기가 좋아 너무나도 좋은 아침
허나 사람들은 폰만 쳐다보네
이미 누워 침대에 now it's 7AM
충혈된 눈으로 그녀의 프로필 보내
Love I'm trynna find that real love
Love I'm trynna find you babe
Too many fuck bois get out of my way
목표를 달성 이젠 나 떠나갈래
난 매일 놀면서 음악해
it's like my birthday
Cali sunshine 행복했던 시절 I miss LA
Damn
One million is what you want
팔로워 or 지갑의 돈
내가 원하는 거는 just fun
둘 다 나쁘다는 건 아냐 물론
형님 너무 serious 마 이게 힙합
행복하자 show me some love
Love
따라라따 따 따 따 따
따라라따 따 따 따
따라라따 따 따 따 따
따라라따 따 따 따
따라라따 따 따 따 따
따라라따 따 따 따
따라라따 따 따 따 따
따라라따 따 따 따
One million is what you want
팔로워 or 지갑의 돈
내가 원하는 거는 just fun
둘 다 나쁘다는 건 아냐 물론
형님 너무 serious 마 이게 힙합
행복하자 show me some love
Love
huh huh ooh ooh
huh huh ooh ooh
huh huh ooh ooh
huh huh ooh ooh
I just want peace
I just want some love
I just want some fun
I just want whatever
I just want peace
I just want some love
I just want some fun
I just want whatever
uh ooh yeah
huh huh ooh ooh
huh huh ooh ooh
huh huh ooh ooh
huh huh ooh ooh
huh huh ooh ooh
huh huh ooh ooh
huh huh ooh ooh",THAMA,2020.08.13,"3,439",랩/힙합
